{
  "$schema": "https://json-schema.org/draft/2020-12/schema",
  "$id": "https://rollinghigh.club/schemas/scenario.schema.json",
  "title": "RHC Entity V2 Scenario",
  "description": "Minimal prepared-situation record. A Scenario is a playable possibility tied to exactly one Primary Hook; it is not a Run and stores no actual-play outcome. Optional provenance classification (HB-01) is logistics-level origin metadata only: it grants no canon authority, reader visibility, character knowledge, or gameplay behavior, is never inferred, and absence on legacy records is treated as unclassified/unknown.",
  "type": "object",
  "required": ["scenario_id", "title", "premise", "objective", "trigger_condition", "primary_hook_id", "related_hook_ids", "related_entity_ids"],
  "additionalProperties": false,
  "properties": {
    "scenario_id": {"type": "string", "pattern": "^S[0-9]{2,}(?![\\s\\S])"},
    "title": {"type": "string", "minLength": 1, "pattern": "\\S"},
    "premise": {"type": "string", "minLength": 1, "pattern": "\\S"},
    "objective": {"type": "string", "minLength": 1, "pattern": "\\S"},
    "trigger_condition": {"type": "string", "minLength": 1, "pattern": "\\S"},
    "primary_hook_id": {"type": "string", "pattern": "^H[0-9]{2,}(?![\\s\\S])"},
    "related_hook_ids": {
      "type": "array",
      "uniqueItems": true,
      "items": {"type": "string", "pattern": "^H[0-9]{2,}(?![\\s\\S])"}
    },
    "related_entity_ids": {
      "type": "array",
      "uniqueItems": true,
      "items": {"type": "string", "pattern": "^(character|location|faction|party|creature|item|ability|status_effect):[a-z0-9]+(-[a-z0-9]+)*(?![\\s\\S])"}
    },
    "provenance": {
      "description": "Optional shared provenance classification of this authored record (HB-01). Exactly one of official, homebrew, adapted, unknown. Logistics metadata only: it grants no canon authority, reader visibility, character knowledge, or gameplay behavior, and is never inferred. Absence on legacy records is treated as unclassified/unknown until an explicit later classification event.",
      "type": "object",
      "additionalProperties": false,
      "required": ["classification"],
      "properties": {
        "classification": {
          "type": "string",
          "enum": ["official", "homebrew", "adapted", "unknown"]
        }
      }
    }
  }
}
